{
  "id": "did:ixo:entity:bbbbbbbbbbbbbbbbbbbbbbbbbbbbbbbb#token",
  "type": "ImpactNFT",
  "name": "Example Impact Token",
  "tokenName": "EXAMPLE",
  "decimals": 0,
  "description": "A conformant example impact token.",
  "image": "https://example.org/token.png",
  "properties": { "denom": "uexample", "icon": "https://example.org/icon.png", "maxSupply": "1000000" }
}
